{
    "id": "official.itgsa",
    "revision": 1,
    "source": "official",
    "title": {
        "translations": {
            "en": "ITGSA Capabilities",
            "zh-Hans": "金标联盟开放能力"
        }
    },
    "icon": {
        "asset": "icons/itgsa.svg",
        "renderMode": "original",
        "tintRole": "on_surface"
    },
    "calculation": {
        "kind": "predicate",
        "predicate": {
            "condition": {
                "any": [
                    {
                        "evidence": "dex_class",
                        "operator": "contains_any",
                        "value": {
                            "dexClasses": [
                                {
                                    "name": {
                                        "operator": "starts_with",
                                        "value": "Lcom/voip/service/"
                                    }
                                },
                                {
                                    "name": {
                                        "operator": "equal",
                                        "value": "Lcom/os/widget/SecurityPasteView;"
                                    }
                                },
                                {
                                    "stringConstants": [
                                        "itgsa.intent.action.TRIM",
                                        "itgsa.intent.action.KILL"
                                    ],
                                    "methodReferences": [
                                        {
                                            "definingClass": "Landroid/content/IntentFilter;",
                                            "name": "<init>",
                                            "parameterTypes": [
                                                "Ljava/lang/String;"
                                            ]
                                        },
                                        {
                                            "definingClass": "Landroid/content/IntentFilter;",
                                            "name": "addAction"
                                        }
                                    ]
                                }
                            ]
                        }
                    },
                    {
                        "evidence": "manifest_receiver_action",
                        "operator": "contains_any",
                        "value": {
                            "strings": [
                                "itgsa.intent.action.TRIM",
                                "itgsa.intent.action.KILL"
                            ]
                        }
                    }
                ]
            },
            "matchedTitle": {
                "translations": {
                    "en": "ITGSA apps",
                    "zh-Hans": "已适配金标联盟能力"
                }
            },
            "unmatchedTitle": {
                "translations": {
                    "en": "Other apps",
                    "zh-Hans": "其他应用"
                }
            }
        }
    },
    "fingerprint": "artifact"
}
