{
    "id": "official.target-sdk-35-plus",
    "revision": 1,
    "source": "official",
    "title": {
        "translations": {
            "en": "Target SDK 35+",
            "zh": "Target SDK 35+",
            "zh-CN": "Target SDK 35+"
        }
    },
    "icon": {
        "asset": "icons/android-15.svg",
        "renderMode": "monochrome",
        "tintRole": "on_surface"
    },
    "calculation": {
        "kind": "predicate",
        "predicate": {
            "evidence": "target_sdk",
            "operator": "greater_than_or_equal",
            "value": {
                "integer": 35
            },
            "matchedTitle": {
                "translations": {
                    "en": "Target SDK 35 or newer",
                    "zh": "Target SDK 35 及以上",
                    "zh-CN": "Target SDK 35 及以上"
                }
            },
            "unmatchedTitle": {
                "translations": {
                    "en": "Target SDK 34 or older",
                    "zh": "Target SDK 34 及以下",
                    "zh-CN": "Target SDK 34 及以下"
                }
            }
        }
    }
}
